{
  "eventId": "90000013-0000-4000-8000-000000000001",
  "eventType": "QuoteAccepted",
  "eventVersion": 1,
  "occurredAt": "2026-09-27T10:00:00Z",
  "aggregateId": "33333333-3333-4333-8333-333333333333",
  "aggregateVersion": 2,
  "correlationId": "ejemplo-contrato",
  "producer": "quotation-service",
  "data": {
    "quoteId": "33333333-3333-4333-8333-333333333333",
    "quoteNumber": "COT-3333",
    "customerId": "11111111-1111-4111-8111-111111111111",
    "vehicleId": "22222222-2222-4222-8222-222222222222",
    "premium": 1412.5,
    "currency": "PEN",
    "tariffTableId": "77777777-7777-4777-8777-777777777777",
    "createdAt": "2026-09-27T09:55:00Z",
    "expiresAt": "2026-10-12T09:55:00Z",
    "breakdown": null
  }
}
